{
  "$schema": "../schema/problem-bank.schema.json",
  "bank_id": "PROBLEM-BANK-QDA-0.1",
  "version": "0.1.0",
  "severity_order": [
    "low",
    "medium",
    "high",
    "critical"
  ],
  "matching_policy": {
    "minimum_basis": "At least one observed signal and one supporting evidence reference.",
    "prohibition": "Do not diagnose a problem solely from a keyword or absent artifact that was not applicable.",
    "confidence_scale": {
      "low": "one weak signal",
      "medium": "multiple consistent signals",
      "high": "direct observation or reproduced defect"
    },
    "reporting": "Matched problems must distinguish observation, inference, and evaluator judgment."
  },
  "patterns": [
    {
      "problem_id": "PROB-001",
      "name": "False-PASS validator",
      "risk_level": "critical",
      "applicable_stages": [
        "agent_work",
        "build_result"
      ],
      "applicable_archetype_ids": [
        "*"
      ],
      "problem_statement": "The validator reports PASS while representative release-breaking mutations remain undetected.",
      "pattern": "Validation checks presence or shallow shape but not the invariants needed for the release claim.",
      "observable_signals": [
        "critical mutations return exit code 0",
        "validator findings are empty after corrupting an authority surface",
        "release relies on one package-owned validator"
      ],
      "visible_effects": [
        "high confidence PASS with broken package state",
        "defects survive to later releases"
      ],
      "likely_causes": [
        "oracles test implementation details rather than obligations",
        "no mutation suite",
        "validator and verdict share the same assumptions"
      ],
      "consequences": [
        "invalid baseline selection",
        "release regression",
        "false assurance"
      ],
      "detection_methods": [
        "apply isolated single-fault mutations",
        "require exact finding codes",
        "cross-check with an independently implemented auditor"
      ],
      "corrective_actions": [
        "block PASS",
        "implement invariant-level checks",
        "add isolated mutations for each critical contract",
        "rerun from a clean extraction"
      ],
      "preventive_controls": [
        "define defect fixtures before implementation",
        "separate builder and release oracle",
        "version the mutation suite"
      ],
      "required_evidence": [
        "validator source",
        "mutation input",
        "stdout/stderr",
        "expected and observed finding code"
      ],
      "related_hard_gate_ids": [
        "HG-002"
      ],
      "real_examples": [
        {
          "example_id": "EX-V14-VAL",
          "project": "ADOS Glossary",
          "versions": [
            "1.4"
          ],
          "observation": "The package validator accepted seven severe mutations, including an unregistered file, corrupt manifest hash, empty schema index, rejected ADR, empty work plan, missing summary, and broken evidence path.",
          "lesson": "A clean PASS is not evidence of defect sensitivity."
        },
        {
          "example_id": "EX-V15-VAL",
          "project": "ADOS Glossary",
          "versions": [
            "1.5"
          ],
          "observation": "Independent mutation checks found five severe changes still accepted, including empty evidence, unverified work, semantic contradiction, broken Reflection evidence, and fabricated proof identity or hashes.",
          "lesson": "Coverage counts did not establish invariant enforcement."
        }
      ]
    },
    {
      "problem_id": "PROB-002",
      "name": "Coverage without contract strength",
      "risk_level": "critical",
      "applicable_stages": [
        "build_package",
        "agent_work",
        "build_result"
      ],
      "applicable_archetype_ids": [
        "ARCH-SCHEMA-GOVERNED-KNOWLEDGE",
        "ARCH-SOFTWARE-LIBRARY-CLI-SDK",
        "ARCH-DATA-PIPELINE-DATASET",
        "ARCH-POLICY-CONTROL-PACK"
      ],
      "problem_statement": "Every instance is nominally assigned a schema, but the schemas do not constrain meaningful content.",
      "pattern": "Coverage percentage is optimized by using generic, open, or container-only schemas.",
      "observable_signals": [
        "additionalProperties is unrestricted on critical records",
        "only schema_version or top-level type is required",
        "negative fixtures pass"
      ],
      "visible_effects": [
        "100% schema coverage with low defect detection",
        "invalid or contradictory records validate"
      ],
      "likely_causes": [
        "metric substitution",
        "pressure to reach coverage targets",
        "schema migration by weakening"
      ],
      "consequences": [
        "contract regression",
        "silent data corruption",
        "misleading governance metrics"
      ],
      "detection_methods": [
        "compare required fields and constraints to the baseline",
        "run malformed and semantically contradictory fixtures",
        "inspect closed-object policy"
      ],
      "corrective_actions": [
        "restore required properties and item schemas",
        "use explicit extension fields",
        "add constraint-strength regression metrics"
      ],
      "preventive_controls": [
        "define critical-schema minimums",
        "reject weakening unless authorized",
        "track constraint counts and semantic invariants"
      ],
      "required_evidence": [
        "schema diff",
        "positive and negative validation results",
        "authorization for weakened constraints"
      ],
      "related_hard_gate_ids": [
        "HG-006"
      ],
      "real_examples": [
        {
          "example_id": "EX-V15-SCHEMA",
          "project": "ADOS Glossary",
          "versions": [
            "1.5"
          ],
          "observation": "Complete JSON governance was claimed while several critical schemas were permissive or validated only shallow containers.",
          "lesson": "Binding coverage and schema quality must be scored separately."
        }
      ]
    },
    {
      "problem_id": "PROB-003",
      "name": "Assertion-only evidence",
      "risk_level": "critical",
      "applicable_stages": [
        "agent_work",
        "build_result"
      ],
      "applicable_archetype_ids": [
        "*"
      ],
      "problem_statement": "Evidence records state PASS without recording the observation that would support it.",
      "pattern": "The evidence ledger stores target paths and statuses but omits procedure, expected result, observed result, provenance, or output.",
      "observable_signals": [
        "status=pass is the main evidence field",
        "same generic ledger entry supports many gates",
        "no stdout, diff, timestamp, or hash"
      ],
      "visible_effects": [
        "claims cannot be independently checked",
        "later reviewers cannot distinguish execution from declaration"
      ],
      "likely_causes": [
        "evidence schema is too weak",
        "evidence is generated in bulk after work",
        "QA and evidence are conflated"
      ],
      "consequences": [
        "unverifiable release",
        "stale evidence reuse",
        "false PASS"
      ],
      "detection_methods": [
        "sample evidence records against the claim they support",
        "verify observation and provenance fields",
        "resolve referenced artifacts"
      ],
      "corrective_actions": [
        "mark unsupported claims unconfirmed",
        "regenerate evidence from actual checks",
        "separate evidence capture from QA judgment"
      ],
      "preventive_controls": [
        "strict evidence schema",
        "minimum observation fields",
        "one evidence item may support multiple claims only when scope is explicit"
      ],
      "required_evidence": [
        "command or procedure",
        "expected",
        "observed",
        "timestamp",
        "verifier",
        "artifact hash",
        "result"
      ],
      "related_hard_gate_ids": [
        "HG-003"
      ],
      "real_examples": [
        {
          "example_id": "EX-V15-EVIDENCE",
          "project": "ADOS Glossary",
          "versions": [
            "1.5"
          ],
          "observation": "The 103 work-verification records were chiefly PASS assertions pointing at target files rather than observation-bearing verification records.",
          "lesson": "One-file work cardinality does not prove one-file verification."
        }
      ]
    },
    {
      "problem_id": "PROB-004",
      "name": "Builder-owned release oracle",
      "risk_level": "high",
      "applicable_stages": [
        "build_package",
        "agent_work",
        "build_result"
      ],
      "applicable_archetype_ids": [
        "*"
      ],
      "problem_statement": "The same implementation process creates the artifact, validator, evidence, QA score, and release verdict.",
      "pattern": "A single trust domain certifies itself without an independent logic path.",
      "observable_signals": [
        "validator is authored during the same build",
        "QA report repeats validator output",
        "no independent recomputation"
      ],
      "visible_effects": [
        "shared blind spots",
        "circular release acceptance"
      ],
      "likely_causes": [
        "insufficient separation of duties",
        "small build prompt treats internal PASS as final"
      ],
      "consequences": [
        "systematic false positives",
        "unfair comparison"
      ],
      "detection_methods": [
        "independently recompute key invariants",
        "review validator assumptions",
        "run external mutation tests"
      ],
      "corrective_actions": [
        "treat package validator as one evidence source",
        "add independent audit",
        "compare outputs and investigate disagreement"
      ],